{
  "$schema": "http://json-schema.org/draft-07/schema#",
  "title": "Credential",
  "description": "A credential in the Life Engine canonical data model.",
  "type": "object",
  "required": ["id", "type", "issuer", "issued_date", "claims", "source", "source_id", "created_at", "updated_at"],
  "properties": {
    "id": {
      "type": "string",
      "description": "Unique identifier assigned by Core"
    },
    "type": {
      "type": "string",
      "enum": ["oauth_token", "api_key", "identity_document", "passkey"],
      "description": "The type of credential stored"
    },
    "issuer": {
      "type": "string",
      "description": "The authority that issued the credential (e.g. google.com, github.com, au.gov)"
    },
    "issued_date": {
      "type": "string",
      "format": "date-time",
      "description": "Date the credential was issued in ISO 8601 format"
    },
    "expiry_date": {
      "type": "string",
      "format": "date-time",
      "description": "Expiration date in ISO 8601 format (null for non-expiring credentials)"
    },
    "claims": {
      "type": "object",
      "description": "Type-specific data. The shape depends on the credential type."
    },
    "source": {
      "type": "string",
      "description": "Identifier of the connector or plugin that produced this record"
    },
    "source_id": {
      "type": "string",
      "description": "The record's original ID in the source system"
    },
    "created_at": {
      "type": "string",
      "format": "date-time",
      "description": "Record creation timestamp"
    },
    "updated_at": {
      "type": "string",
      "format": "date-time",
      "description": "Record last-updated timestamp"
    }
  },
  "additionalProperties": false
}
