{
  "id": "550e8400-e29b-41d4-a716-446655440002",
  "type": "oauth_token",
  "issuer": "https://auth.example.com",
  "issued_date": "2026-01-15T00:00:00Z",
  "expiry_date": "2027-01-15T00:00:00Z",
  "claims": {
    "scope": "read write",
    "sub": "user-12345"
  },
  "source": "test",
  "source_id": "test-cred-001",
  "created_at": "2026-01-15T10:30:00Z",
  "updated_at": "2026-01-15T10:30:00Z"
}
