{
  "id": "550e8400-e29b-41d4-a716-446655440000",
  "type": "oauth_token",
  "issuer": "https://accounts.google.com",
  "issued_date": "2026-01-15",
  "expiry_date": "2026-04-15",
  "claims": {
    "scope": "https://www.googleapis.com/auth/calendar.readonly",
    "sub": "user-google-12345",
    "token_type": "Bearer"
  },
  "source": "google",
  "source_id": "fixture-cred-001",
  "created_at": "2026-01-15T10:30:00Z",
  "updated_at": "2026-01-15T10:30:00Z"
}
